{
  "schema": "command-terrain-observation",
  "version": 1,
  "world": {
    "addonId": "1234567890ABCDEF",
    "guid": "ABCDEF1234567890",
    "path": "Worlds/Fixture.ent"
  },
  "observedWorldFile": "Worlds/Fixture.ent",
  "engineVersion": "Synthetic documentation example - not an engine measurement",
  "method": "GetSurfaceY",
  "samples": [
    {
      "worldX": 4010,
      "worldZ": 5020,
      "surfaceY": 100
    },
    {
      "worldX": 4020,
      "worldZ": 5040,
      "surfaceY": 120
    }
  ]
}
